{
  "id": "stub_phi02",
  "version": 1,
  "created_at": null,
  "interference_seed": {
    "phi": [3, 5, 8, 13, 21, 34, 5],
    "gate_burn": "b1ef7ea928d13f59a1dfc632294f4c28",
    "detune_drift_vector": [0.01234567, -0.00345678, 0.00012345],
    "invariant_residue": "a488a6d6233772795596ge64"
  },
  "completeness": "intentionally_incomplete",
  "semantic_payload": null,
  "sentinel": "PLACEHOLDER"
}
